[
  {
    "id": "3.1.1", "slug": "intellectual-disability", "group": "neurodevelopmental",
    "title": "Intellectual Disability (Intellectual Developmental Disorder)",
    "target": "Intellectual Disability",
    "targetDescription": "Deficits in intellectual and adaptive functioning with onset during the developmental period.",
    "differentials": [
      { "disorder": "Major/Mild Neurocognitive Disorder", "distinction": "Involves acquired decline from a previously attained level of functioning, rather than deficits present from the developmental period.", "table": "3.16.2" },
      { "disorder": "Specific Learning Disorder", "distinction": "Deficits are circumscribed to specific academic skills without global impairment of intellectual and adaptive functioning.", "table": "3.1.5" },
      { "disorder": "Communication Disorders / Language Disorder", "distinction": "Impairment is limited to communication/language; nonverbal intellectual and adaptive functioning are relatively preserved.", "table": "3.1.2" },
      { "disorder": "Autism Spectrum Disorder", "distinction": "Defined by social-communication deficits and restricted/repetitive behavior; may co-occur with intellectual disability, in which case both are diagnosed.", "table": "3.1.3" }
    ]
  },
  {
    "id": "3.1.2", "slug": "communication-disorders", "group": "neurodevelopmental",
    "title": "Communication Disorders",
    "target": "Communication Disorders (Language, Speech Sound, Childhood-Onset Fluency, Social Pragmatic)",
    "targetDescription": "Persistent difficulties in language, speech production, fluency, or the social use of communication.",
    "differentials": [
      { "disorder": "Intellectual Disability", "distinction": "Communication problems are part of a broader deficit in intellectual and adaptive functioning rather than a circumscribed language/speech deficit.", "table": "3.1.1" },
      { "disorder": "Autism Spectrum Disorder", "distinction": "Includes restricted/repetitive behaviors and interests in addition to social-communication deficits; Social (Pragmatic) Communication Disorder is diagnosed only when ASD is excluded.", "table": "3.1.3" },
      { "disorder": "Hearing or other sensory impairment", "distinction": "Communication difficulty is fully attributable to a sensory deficit and resolves/adapts with appropriate accommodation." },
      { "disorder": "Selective Mutism", "distinction": "Language capacity is intact but the child fails to speak in specific social situations.", "table": "3.5.2" },
      { "disorder": "Normal variation", "distinction": "Language/speech is within the expected range for developmental level and cultural/linguistic context." }
    ]
  },
  {
    "id": "3.1.3", "slug": "autism-spectrum-disorder", "group": "neurodevelopmental",
    "title": "Autism Spectrum Disorder",
    "target": "Autism Spectrum Disorder",
    "targetDescription": "Persistent deficits in social communication/interaction plus restricted, repetitive patterns of behavior, interests, or activities, with onset in the early developmental period.",
    "differentials": [
      { "disorder": "Social (Pragmatic) Communication Disorder", "distinction": "Social-communication deficits are present but restricted/repetitive behaviors are absent.", "table": "3.1.2" },
      { "disorder": "Intellectual Disability", "distinction": "Social communication is commensurate with developmental level; diagnosed additionally when social-communication deficits exceed developmental level.", "table": "3.1.1" },
      { "disorder": "Attention-Deficit/Hyperactivity Disorder", "distinction": "Attentional/behavioral problems without the qualitative social-communication deficits and restricted interests of ASD (may co-occur).", "table": "3.1.4" },
      { "disorder": "Selective Mutism", "distinction": "Early development and social communication are typically normal; failure to speak is situation-specific.", "table": "3.5.2" },
      { "disorder": "Stereotypic Movement Disorder", "distinction": "Stereotypies occur without the social-communication deficits of ASD." },
      { "disorder": "Schizophrenia (childhood onset)", "distinction": "Includes a period of delusions/hallucinations and follows a prodrome; ASD lacks positive psychotic symptoms.", "table": "3.2.1" }
    ]
  },
  {
    "id": "3.1.4", "slug": "adhd", "group": "neurodevelopmental",
    "title": "Attention-Deficit/Hyperactivity Disorder",
    "target": "Attention-Deficit/Hyperactivity Disorder",
    "targetDescription": "Persistent inattention and/or hyperactivity-impulsivity, onset before age 12, present in ≥2 settings and impairing functioning.",
    "differentials": [
      { "disorder": "Oppositional Defiant Disorder", "distinction": "Resistance to tasks reflects opposition to authority rather than an inability to sustain attention.", "table": "3.14.1" },
      { "disorder": "Specific Learning Disorder", "distinction": "Inattentive appearance is limited to academically demanding tasks and stems from skill deficits.", "table": "3.1.5" },
      { "disorder": "Intellectual Disability", "distinction": "Symptoms are commensurate with mental age; ADHD diagnosed additionally if inattention/hyperactivity exceed developmental level.", "table": "3.1.1" },
      { "disorder": "Bipolar Disorder", "distinction": "Inattention/overactivity is episodic and accompanied by mood elevation, whereas ADHD is chronic and non-episodic.", "table": "3.3.1" },
      { "disorder": "Disruptive Mood Dysregulation Disorder", "distinction": "Characterized by persistent irritability and severe temper outbursts beyond the impulsivity of ADHD.", "table": "3.4.4" },
      { "disorder": "Anxiety Disorders", "distinction": "Inattention is due to worry/rumination rather than distractibility by external stimuli.", "table": "3.5.7" },
      { "disorder": "Substance Use Disorders", "distinction": "Inattention began with substance use rather than in childhood.", "table": "3.15.1" }
    ]
  },
  {
    "id": "3.1.5", "slug": "specific-learning-disorder", "group": "neurodevelopmental",
    "title": "Specific Learning Disorder",
    "target": "Specific Learning Disorder",
    "targetDescription": "Persistent difficulties learning and using academic skills (reading, writing, or mathematics) below expectation for age, not explained by other conditions.",
    "differentials": [
      { "disorder": "Intellectual Disability", "distinction": "Academic difficulties are part of global intellectual and adaptive impairment.", "table": "3.1.1" },
      { "disorder": "Normal academic variation / lack of instruction", "distinction": "Underperformance is due to inadequate instruction, absence, or environmental factors rather than a learning disorder." },
      { "disorder": "Neurocognitive Disorder", "distinction": "Represents a decline from previously attained academic skills rather than a developmental difficulty acquiring them.", "table": "3.16.2" },
      { "disorder": "ADHD", "distinction": "Poor academic performance stems from inattention; may co-occur with specific learning disorder.", "table": "3.1.4" },
      { "disorder": "Sensory impairment (vision/hearing)", "distinction": "Learning difficulty is attributable to an uncorrected sensory deficit." }
    ]
  },
  {
    "id": "3.1.6", "slug": "tic-disorders", "group": "neurodevelopmental",
    "title": "Tic Disorders",
    "target": "Tic Disorders (Tourette's, Persistent Motor/Vocal, Provisional)",
    "targetDescription": "Sudden, rapid, recurrent, nonrhythmic motor movements and/or vocalizations with onset before age 18.",
    "differentials": [
      { "disorder": "Other movement disorders (chorea, dystonia, myoclonus)", "distinction": "Movements are rhythmic or sustained and not suppressible/preceded by a premonitory urge as tics are." },
      { "disorder": "Substance/medication-induced movements", "distinction": "Abnormal movements are temporally related to a substance or medication (e.g., stimulants, neuroleptics)." },
      { "disorder": "Obsessive-Compulsive Disorder", "distinction": "Compulsions are goal-directed and preceded by an obsession, whereas complex tics are less purposeful.", "table": "3.6.1" },
      { "disorder": "Stereotypic Movement Disorder", "distinction": "Movements are rhythmic, fixed, and driven rather than the brief, variable, suppressible pattern of tics." },
      { "disorder": "Movements due to another medical condition", "distinction": "Abnormal movements are attributable to a neurological condition (e.g., Huntington's, postviral)." }
    ]
  },
  {
    "id": "3.2.1", "slug": "schizophrenia", "group": "psychotic",
    "title": "Schizophrenia or Schizophreniform Disorder",
    "target": "Schizophrenia / Schizophreniform Disorder",
    "targetDescription": "Two or more active-phase symptoms (delusions, hallucinations, disorganized speech, grossly disorganized/catatonic behavior, negative symptoms) with functional decline; ≥6 months for schizophrenia, 1–6 months for schizophreniform.",
    "differentials": [
      { "disorder": "Schizoaffective Disorder", "distinction": "A mood episode is present for the majority of the total illness duration, with ≥2 weeks of psychosis without prominent mood symptoms.", "table": "3.2.2" },
      { "disorder": "Bipolar/Depressive Disorder With Psychotic Features", "distinction": "Psychotic symptoms occur exclusively during mood episodes.", "table": "3.4.1" },
      { "disorder": "Delusional Disorder", "distinction": "Delusions occur without the other active-phase symptoms and functioning is otherwise relatively preserved.", "table": "3.2.3" },
      { "disorder": "Brief Psychotic Disorder", "distinction": "Duration is at least 1 day but less than 1 month with return to premorbid functioning.", "table": "3.2.4" },
      { "disorder": "Substance/Medication-Induced Psychotic Disorder", "distinction": "Psychosis is attributable to a substance and typically remits with sustained abstinence." },